{"from":"curvez-reviewer","to":["curvez-orchestrator"],"status":"done","summary":"DSG-05 재리뷰 1회차. 판정: 닫힘. 재현 조건(360px, variant=back, '교정연령 적용 종료 안내')에서 제목 박스는 [128,232]이고 가운데 칸 폭 104px 과 같다. 뒤로가기 버튼과 겹친 폭은 0px 이다(이전 20.5px). 측정은 두 가지로 했다. (1) 기존 .next 산출물(BUILD_ID 01:00, 소스 수정 00:55 이후)의 정적 HTML 7개 화면 × 360/390/768/1280 = 28개 조합. (2) jiti 로 렌더한 dashboard variant 와 headingLevel=2 두 가지 × 4개 폭 = 8개 조합. 합계 36개 조합에서 좌우 겹침 0px, scrollWidth 는 뷰포트 폭과 같고, 제목과 헤더의 중심 차이는 최대 0.01px 이다. 헤더 높이는 36개 조합 모두 64px, 뒤로가기·메뉴 버튼 높이는 48px 이다. Apple SD Gothic Neo 로 렌더된 현재 제목 5종은 모든 폭에서 2줄 이하이며, line-clamp 로 잘린 경우는 0건이다. 정적 HTML 에서 페이지별 h1 은 1개다. guide 는 헤더가 H2, 다른 화면은 H1 이다. 리뷰 축 5개 검증 결과: 축1 수용 기준 검증, 축2 경계 검증(변경은 shared/ui 와 views 안에서만 있고 새 import 없음), 축3 디자인 검증, 축4 실패 경로는 해당 없음(순수 표시 컴포넌트), 축5 타입 검증. blocker 0, major 0, minor 1. 미검증: Android 기기 폰트(Noto Sans CJK KR 등)에서 실제로 몇 줄이 되는지는 설치된 폰트가 없어 재지 못했다. 사용자 흐름이 들어간 E2E 는 curvez-qa 가 따로 돌리고 있어 이 리뷰의 근거로 쓰지 않았다.","artifacts":[],"decisions":[{"what":"DSG-05 를 닫힘으로 판정했다","why":"jiti+chromium setContent 로 36개 조합을 쟀다. 제목 박스 폭이 grid 가운데 칸 폭과 같고(360px 에서 '112px 104px 112px' 에 제목 폭 104px), 좌우 zone 과 겹친 폭은 모든 조합에서 0px 이다. justifySelf:stretch 와 minWidth:0 을 쓰면 구조상 칸 밖으로 넘칠 수 없다","reversible_at":"findings 에 DSG-05 를 다시 추가하면 된다"},{"what":"PageHeader.md:13 의 말줄임 규칙(white-space:nowrap, ellipsis)과 구현(2줄 line-clamp)이 다른 점은 지적하지 않았다","why":"오케스트레이터가 '말줄임 대신 2줄까지 줄바꿈'으로 결정했다. 스펙 문서를 갱신하는 일은 curvez-designer 몫이다. 지시서대로 DSG-06~08 과 남은 P3 도 다시 내지 않았다","reversible_at":"findings 에 DSG-09 로 추가하면 된다"},{"what":"headingLevel prop 이 다른 화면의 제목 구조를 바꾸지 않았다고 판정했다","why":"headingLevel 을 넘기는 곳은 GuideView.tsx:17 하나뿐이다. 정적 HTML 에서 dashboard·share·age-basis·checkups·copay-relief·correction-period 의 헤더는 H1 이고 h1 은 1개다. guide 는 헤더가 H2 이고 본문 h1 이 1개다. 소스에서 h1 리터럴은 GuideView.tsx:19 하나뿐이다. 입력 화면(/)은 Suspense fallback=null 이라 정적 HTML 에 헤더가 없다. 다만 같은 title-only 에 siteName 조합을 share·dashboard 에서 쟀으므로 동일 배치로 본다","reversible_at":"findings 에 ACC-01 로 추가하면 된다"},{"what":"하이드레이션 위험은 없다고 판정했다","why":"Heading 태그는 정적 prop(headingLevel)만으로 정해진다. 브라우저 전용 값(window, localStorage, Date)에 따라 갈리는 분기가 없다. 서버 컴포넌트 GuideView 는 숫자 리터럴 2 만 넘긴다. 정적 HTML 의 inline style 직렬화(-webkit-line-clamp:2, display:-webkit-box)가 React 클라이언트 스타일 객체와 같은 키에서 나온다","reversible_at":"findings 에 TYP-01 로 추가하면 된다"},{"what":"guide 헤더가 h2 이고 본문 h1 보다 문서 순서상 앞에 오는 점은 지적하지 않았다","why":"레벨이 올라가는 순서(h2 다음 h1)는 heading-order 위반이 아니다. 페이지당 h1 1개 조건은 충족한다. 오케스트레이터 결정과도 같다","reversible_at":"findings 에 DSG-09 로 추가하면 된다"},{"what":"nf-header-layout.spec.ts 의 guide 3건 실패는 지적하지 않았다","why":"headingLevel 변경으로 예상된 테스트 갱신 건이다. curvez-nextjs 핸드오프 decisions 에 이미 curvez-qa 몫으로 적혀 있다. 제품 코드의 결함이 아니다","reversible_at":"findings 에 ACC-02 로 추가하면 된다"}],"blocked_on":[],"verification":[{"command":"pnpm typecheck (profile.commands.typecheck, 워크트리 루트)","result":"exit 0. 전 워크스페이스 Types generated successfully / Done","passed":true},{"command":"pnpm lint (profile.commands.lint, 워크트리 루트)","result":"exit 0. 전 워크스페이스 Done, 경고·오류 출력 없음","passed":true},{"command":"node -e (.next/server/app/*.html 7개 화면에서 script 제거, .next/static/chunks/3zowc5or7q8cd.css 인라인, @playwright/test chromium 153 setContent) × 폭 360/390/768/1280","result":"28개 조합에서 좌우 겹침 0px, scrollWidth 는 뷰포트 폭과 같음, 중심 차이 최대 0.01px, header 높이 64px, 뒤로가기 버튼 48px. 360px 는 grid '112px 104px 112px', 제목 [128,232], 5개 제목 모두 2줄(60px). 390px 는 '어느 나이를 쓰나'만 1줄, 나머지는 2줄. 768/1280px 는 모두 1줄. clamp 를 풀고 잰 줄 수도 모두 2 이하라 잘린 제목 0건. 화면별 h1 개수 1. index.html 은 헤더가 없음(Suspense fallback=null)","passed":true},{"command":"node -e (jiti 2.7.0, alias @→src, jsx automatic 으로 PageHeader.tsx 를 renderToStaticMarkup → chromium setContent). variant=dashboard 와 title-only+headingLevel=2 × 4개 폭","result":"8개 조합에서 겹침 0px, 메뉴 버튼 48x48, header 64px, 중심 차이 0. 1280px dashboard 는 grid '445.328px 165.344px 445.328px'. headingLevel=2 는 H2 로 렌더됨","passed":true},{"command":"node -e (CDP CSS.getPlatformFontsForNode 로 실제 렌더 폰트 확인, 104px 폭에서 제목별 max-content 와 줄 수 측정)","result":"globals.css 폰트 스택은 이 환경에서 Apple SD Gothic Neo Bold 로 렌더된다. '교정연령 적용 종료 안내' max-content 는 186.3px 로, 2줄 용량 약 208px 대비 여유가 약 22px 이다. 한글 자폭이 더 넓은 AppleGothic 에서는 '교정연령 적용 종료 안내'(219.2px)·'본인부담 경감 종료일'(192.8px)·'이른둥이 육아 계산기'(192.8px)가 3줄이 필요하다. Noto Sans KR·Malgun Gothic 은 이 환경에 설치돼 있지 않아 AppleMyungjo 로 대체됐고, 그 수치는 근거로 쓰지 않았다","passed":true}],"findings":[{"id":"DSG-09","kind":"design","severity":"minor","what":"[확인 필요] 360px 에서 한글 자폭이 넓은 폰트를 쓰는 기기라면 현재 제목 3종이 3줄을 필요로 해, line-clamp:2 에 걸려 둘째 줄 끝이 말줄임으로 잘릴 수 있다","where":"apps/preemie-calc/src/shared/ui/PageHeader.tsx:90","why":"Apple SD Gothic Neo 기준으로는 잘림이 0건이라 macOS·iOS 에서는 오케스트레이터 결정(2줄까지 줄바꿈)을 지킨다. 그러나 여유가 약 22px(약 10%)뿐이다. AppleGothic 처럼 한글 자폭이 약 1em 인 폰트에서는 '교정연령 적용 종료 안내'·'본인부담 경감 종료일'·'이른둥이 육아 계산기'가 104px 칸에서 3줄이 된다. 360px 폭의 주 사용 기기는 Android(system-ui, Noto Sans CJK KR 계열)다. 그런데 이 폰트가 설치돼 있지 않아 실측하지 못했다. 등급은 major 와 minor 사이에서 갈렸다. 잘려도 말줄임 표시가 나오고, 원래 스펙도 말줄임을 받아들였으므로 낮은 쪽인 minor 를 골랐다. Android Chrome 360px 실기기나 Noto Sans CJK KR 을 넣은 측정에서 2줄 이하로 나오면 이 지적은 닫는다. 수정 방향: 잘림이 확인되면 제목 문구를 줄이거나 side-reserve 값을 조정할지 curvez-designer 가 판단한다","evidence":"재현: 360px 뷰포트에서 /dashboard/correction-period 를 font-family:AppleGothic 으로 렌더한다. node -e 로 chromium 에서 104px 폭, 20px bold, line-height 30px 로 측정했다. 줄 수는 '교정연령 적용 종료 안내' 3, '본인부담 경감 종료일' 3, '이른둥이 육아 계산기' 3, '영유아검진 도우미' 2, '어느 나이를 쓰나' 2. 같은 조건에서 Apple SD Gothic Neo 는 모두 2줄 이하였다. Android 폰트는 실행 확인 못 함(폰트 미설치)"}]}
