{
  "from": "curvez-reviewer",
  "to": ["curvez-orchestrator", "curvez-nextjs"],
  "status": "partial",
  "summary": "리뷰 축 5개를 모두 확인했다. 지적은 blocker 0, major 3, minor 0 이다. 요청 판정 다섯 가지의 결과는 이렇다. (1) 통과: jiti 로 classifyCopayRelief 를 0·150·202·203·204·230·231·232·258·259·260일에 돌렸고, 203일(29주 0일)→5년 3개월, 231일(33주 0일)→5년 2개월, 202일→5년 4개월, 259일→대상 아님으로 원문과 전부 같았다. (2) 통과: 종료 예정일도 같은 구간 기간을 쓴다. 출생일 2026-01-15 기준으로 202일→2031-05-15, 203일→2031-04-15, 231일→2031-03-15 다. (3) 통과, TEAM-01 은 닫는다: 가이드 화면을 renderToStaticMarkup 으로 그려 보니 '재태기간 33주 이상 37주 미만: 5년 2개월 / 29주 이상 33주 미만: 5년 3개월 / 29주 미만: 5년 4개월' 이 나왔다. PC-F16-AC4 와 같고, 경계 정각의 계산 결과와도 같은 답이다. (4) 데이터 JSON 의 upper-inclusive 는 architecture.md:442-444(④)의 정의(from 포함, 231일→33~37주 구간)와 뜻이 같다. 그런데 조사 브리프 sources-v2.md:83·181·195 의 2026-10-02 정정 메모는 같은 배정(33주 0일→5년 2개월)을 'lower-inclusive' 라고 부른다. 코드에서 lower-inclusive 는 정반대 배정이다(ACC-01). (5) 통과: endDateMethod 는 status '미확정'·openQuestion PRD-9-2 를 유지하고, 계산기와 가이드 양쪽에 미확정 안내가 렌더링된다. 이번 변경에서 새로 생긴 결함이 하나 있다. sourceNotes 에 넣은 정정 경위 문장('PRD 버전 4', 'SPEC 버전 6 PC-F5-AC6·AC7', '조사 브리프 설명이 원문과 반대였고 대조하지 않고 옮겼다')이 계산기 화면과 공개 가이드 화면에 그대로 보인다(DSG-01). E2E 는 FORBIDDEN 이라 돌리지 않았다. 축 3(디자인)은 렌더 결과와 문서로만 확인했고, 화면 캡처로는 확인하지 않았다.",
  "artifacts": [],
  "decisions": [
    {
      "what": "curvez-nextjs 핸드오프가 curvez-architect 에게 올린 blocked_on(architecture.md 가 lower-inclusive 를 말한다)은 이미 해소됐다고 판정했다. 지적하지 않는다",
      "why": "architecture.md:442-444(④ 주석), :1063(⑬ 표), :1087(미결 위치 표), :1202(결정 로그)가 모두 upper-inclusive, 231일→5년 2개월, 203일→5년 3개월로 적혀 있고 JSON 과 같다",
      "reversible_at": "findings 에 BND-01 로 추가하면 된다"
    },
    {
      "what": "tests/unit/copay-relief.test.ts 의 실패 2건(203일 기대 5년 4개월, 231일 기대 5년 3개월)은 findings 에 넣지 않았다",
      "why": "직접 돌려 8건 중 2건 실패를 확인했다. 하지만 curvez-nextjs 핸드오프의 blocked_on 이 이미 curvez-qa 에게 넘겼고, 지시서가 미리 예고한 실패다. 같은 지적을 두 곳에서 내지 않는다",
      "reversible_at": "findings 에 ACC-03 으로 추가하면 된다"
    },
    {
      "what": "GuideQuestionView.tsx:69-78 이 innerBoundary 를 읽지 않고 '◯주 이상 ◯주 미만' 을 고정으로 만드는 점은 지적하지 않는다",
      "why": "지금 값(upper-inclusive)에서는 렌더 결과가 계산 결과와 경계 정각까지 같다. innerBoundary 가 다시 뒤집힐 때만 어긋나는데, PRD 버전 4 가 확정했으므로 지금 재현 조건이 없다",
      "reversible_at": "findings 에 DSG-02 로 추가하면 된다"
    },
    {
      "what": "CopayReliefSection.tsx:30-44 의 boundary-unconfirmed 분기와 model/index.ts:112-117 의 방어 분기는 지금 닿지 않는 경로지만 지적하지 않는다",
      "why": "innerBoundary.status 가 '확정'이라 실행되지 않을 뿐 동작 결함은 없다. 이 분기를 남길지는 구조 문제라 축이 다르다",
      "reversible_at": "findings 에 ERR-01 로 추가하면 된다"
    },
    {
      "what": "지시서가 다시 내지 말라고 한 minor(ERR-04, DSG-04, ACC-09, DSG-06~10, ERR-07·08)는 다시 내지 않았다. lint 경고와 겹치는 지적도 0건이다",
      "why": "지시서의 CONTEXT 에 그렇게 적혀 있고, pnpm lint 출력에 오류·경고가 없다",
      "reversible_at": "이 에이전트 정의의 '## 판단 기준' — 루프 상한"
    }
  ],
  "blocked_on": [],
  "verification": [
    {
      "command": "pnpm typecheck (profile.commands.typecheck, 워크스페이스 루트) + pnpm --filter preemie-calc exec tsc --noEmit -p .",
      "result": "exit 0, 'error TS' 0건. preemie-calc tsc 도 exit 0",
      "passed": true
    },
    {
      "command": "pnpm lint (profile.commands.lint, 워크스페이스 루트)",
      "result": "eslint . 와 7개 프로젝트 lint 모두 Done. 오류·경고 출력 없음",
      "passed": true
    },
    {
      "command": "node --input-type=module -e (jiti 2.7.0 createJiti, alias @→src) 로 entities/copay-relief 의 classifyCopayRelief 를 출생일 2026-01-15 로 실행",
      "result": "innerBoundary={status:확정,value:upper-inclusive}, endDateMethod.status=미확정. 0·150·202일→5년 4개월(2031-05-15), 203·204·230일→5년 3개월(2031-04-15), 231·232·258일→5년 2개월(2031-03-15), 259·260일→not-eligible. unconfirmed=true",
      "passed": true
    },
    {
      "command": "jiti + react-dom/server renderToStaticMarkup 으로 CopayReliefSection(203·231일)과 GuideQuestionView(slug=copay-relief) 렌더",
      "result": "계산기 203일=5년 3개월, 231일=5년 2개월. 가이드='33주 이상 37주 미만: 5년 2개월 / 29주 이상 33주 미만: 5년 3개월 / 29주 미만: 5년 4개월'. 미확정 안내가 양쪽에 보인다. 양쪽 모두 '경계 정정(PRD 버전 4 …) … SPEC 버전 6 PC-F5-AC6·AC7 이 정정된 경계를 확인한다' 문단도 화면에 보인다",
      "passed": false
    },
    {
      "command": "(apps/preemie-calc) pnpm exec vitest run tests/unit/copay-relief.test.ts",
      "result": "8건 중 6건 통과, 2건 실패: expected '5년 3개월' to be '5년 4개월', expected '5년 2개월' to be '5년 3개월'. 옛 경계를 기대값으로 둔 테스트다",
      "passed": false
    },
    {
      "command": "grep -n -i 'inclusive' .curvez/architecture.md .curvez/research/preemie-calc/sources-v2.md ; grep -rln 'lower-inclusive' src tests",
      "result": "architecture.md:443 은 upper-inclusive=231일→33~37주 구간으로 정의한다. sources-v2.md:83·181·195 는 같은 배정을 lower-inclusive 라고 부른다. tests/e2e/nf-mobile.spec.ts:87-94 가 옛 lower-inclusive 기대값을 남겨 두고 있다",
      "passed": false
    }
  ],
  "findings": [
    {
      "id": "DSG-01",
      "kind": "design",
      "severity": "major",
      "what": "sourceNotes 에 넣은 정정 경위 문장이 계산기 화면과 공개 가이드 화면에 그대로 보인다. 이 문장에는 팀 내부 문서 번호와 작업 경위가 들어 있다('PRD 버전 4', 'SPEC 버전 6 PC-F5-AC6·AC7', '조사 브리프 설명이 원문과 반대였고 대조하지 않고 옮겼다')",
      "where": "apps/preemie-calc/src/entities/copay-relief/data/copay-relief.json:28",
      "why": "architecture.md:1060(⑬ 표)는 sourceNotes 값으로 source-nhis 각주 한 건만 정했다. 이 필드는 '출처에 붙는 각주'(architecture.md:446)로 공개 화면에 렌더링된다. 부모가 읽는 화면에 PRD·SPEC 버전과 AC 번호, 내부 작업 실수 경위가 노출된다. design copay-relief.md 의 policy-note 영역에도 없는 문구다. 수정 방향: mohw 각주를 빼고 정정 근거는 architecture.md 결정 로그(:1201-1202)와 requirements.md 의 '미결 2 경계 정정' 표에만 남긴다. 사용자에게 꼭 보여야 하면 원문 구간 문장 하나로 줄인다",
      "evidence": "재현: 재태 203일 또는 231일 프로필로 /dashboard/copay-relief 에 들어가거나 /guide/questions/copay-relief 를 연다. 실행으로 확인했다. jiti 로 renderToStaticMarkup(CopayReliefSection 203·231일, GuideQuestionView slug=copay-relief)을 돌리니 세 출력 모두 '경계 정정(PRD 버전 4, 2026-10-02): … SPEC 버전 6 PC-F5-AC6·AC7 이 정정된 경계를 확인한다' 문단이 들어 있었다. 렌더하는 곳은 src/widgets/copay-relief-result/ui/CopayReliefSection.tsx:61-68 과 src/views/guide-questions/ui/GuideQuestionView.tsx:265-275 다"
    },
    {
      "id": "ACC-01",
      "kind": "acceptance",
      "severity": "major",
      "what": "조사 브리프의 2026-10-02 정정 메모가 '33주 0일→5년 2개월, 29주 0일→5년 3개월' 배정을 'lower-inclusive' 라고 부른다. 코드와 architecture ④ 에서 lower-inclusive 는 정반대 배정(231일→5년 3개월)이다",
      "where": ".curvez/research/preemie-calc/sources-v2.md:83",
      "why": "같은 값 이름이 문서마다 반대 뜻을 가진다. architecture.md:443-444 는 upper-inclusive=from 포함, 231일→33~37주 구간으로 정의하고, JSON 과 model/index.ts:125-131 도 그 뜻으로 구현했다. 그런데 브리프는 181행 반영 제안 표에서 \"value: 'lower-inclusive' 자체는 처음부터 원문과 일치했다\" 고 적는다. 브리프대로 JSON 값을 옮기면 PC-F5-AC6·AC7 이 다시 깨진다. 이번 오판도 브리프 설명이 원문과 반대였던 데서 생겼다. 담당은 curvez-researcher 다. 수정 방향: 181·195행을 포함해 브리프의 값 이름을 architecture ④ 의 정의(upper-inclusive)에 맞추거나, 그 이름이 무엇을 뜻하는지 ④ 를 인용해 명시한다",
      "evidence": "재현: sources-v2.md:83·181·195 의 'lower-inclusive: 33주 0일→5년2개월' 과 architecture.md:443-444, copay-relief.json:55 를 나란히 읽는다. 실행으로 확인했다. grep 출력에서 브리프 세 곳이 lower-inclusive 를 정답 값으로 적은 것을 봤다. 반대 동작은 vitest 로 확인했다. 옛 lower-inclusive 기대값을 둔 테스트가 지금 코드에서 'expected 5년 2개월 to be 5년 3개월' 로 실패한다. 즉 lower-inclusive 일 때 231일은 5년 3개월이다(model/index.ts:127-129)"
    },
    {
      "id": "ACC-02",
      "kind": "acceptance",
      "severity": "major",
      "what": "[확인 필요] E2E nf-mobile.spec.ts 가 재태 203일 화면에서 '5년 4개월' 이 보이기를 기대한다. 이는 PC-F5-AC7(29주 0일→5년 3개월)과 반대다. 게다가 DSG-01 의 각주 문단에 '29주 미만 5년 4개월' 이 들어 있어, 이 테스트가 틀린 기대값인데도 통과할 수 있다",
      "where": "apps/preemie-calc/tests/e2e/nf-mobile.spec.ts:94",
      "why": "PC-F5-AC7 을 거꾸로 확인하는 테스트다. 87-90행의 주석과 테스트 제목도 'lower-inclusive 확정, 203일 5년 4개월' 이라는 옛 결정을 적고 있다. curvez-nextjs 의 blocked_on 은 단위 테스트만 curvez-qa 에게 넘겼고 이 파일은 빠졌다. E2E 를 돌리지 못해 통과·실패를 확인하지 못했으므로 blocker 가 아닌 major 로 둔다. 담당은 curvez-qa 다. 수정 방향: 기대값을 '5년 3개월' 로 바꾼다. 결과 카드(ValueCard)로 범위를 좁혀 각주 문단의 같은 글자와 섞이지 않게 한다",
      "evidence": "재현: 출생일 BIRTH, 재태 203일 프로필로 /dashboard/copay-relief 를 연다. 실행 확인 못 함(읽기만 함): E2E 는 FORBIDDEN 이다. 근거 두 가지를 실행으로 확인했다. 첫째, 같은 조건의 renderToStaticMarkup 결과에서 결과 카드는 '5년 3개월' 이다. 둘째, 같은 화면의 sourceNotes 문단에 '\"29주 미만 5년 4개월\"' 문자열이 있다. Playwright getByText 는 기본이 부분 일치라 이 문단 하나에 맞을 수 있다"
    }
  ]
}
