{"from":"curvez-reviewer","to":["curvez-orchestrator"],"status":"done","summary":"통합 라운드 재리뷰 2/2(마지막)입니다. 리뷰 축 5개를 모두 검증했습니다. 축 3은 formula.md 34행만 다시 대조했습니다. 지난 지적 3건은 모두 닫혔습니다. ERR-05, ERR-06, DSG-02 입니다. 이번 수정이 건드린 줄에서 새 지적 2건이 나왔고 둘 다 minor 입니다(ERR-07, ERR-08). blocker 와 major 는 0건입니다. 두 지적은 뿌리가 같습니다. 저장소가 손상됐을 때 이제 쓰기를 거부하는데, 그 결과를 화면이 받아 주지 않습니다. 백슬래시, 유니코드, 퍼센트 인코딩, 공백과 제어 문자, 쿼리와 해시를 섞은 경우를 jiti 로 31개 돌렸습니다. normalizeReturnPath 가 null 이 아닌 값을 돌려준 경우는 전부 '/dashboard' 로 시작했고, 다시 해석해도 origin 이 바뀌지 않았으며, 다시 넣어도 같은 값이 나왔습니다. 그래서 nextjs 가 '/dashboard?x=//evil.com' 과 '/dashboard#//evil.com' 을 허용한 판단은 안전하다고 봅니다. 브라우저 실행과 build/E2E 는 지시에 따라 돌리지 않았습니다. 읽은 소스 파일은 8개입니다.","artifacts":[],"decisions":[{"what":"ERR-05 닫힘","why":"return-path/index.ts:37-53 은 new URL 로 해석합니다. 그다음 origin 이 그대로인지, pathname 이 '//' 로 시작하지 않는지, 허용 목록 안인지 보고, 해석된 pathname+search 를 돌려줍니다. 지난 라운드 재현 값 '/dashboard/..//evil.com', '%2e%2e', '.%2e' 변형, 탭·개행이 섞인 경우, '/dashboard/../guide' 는 nextjs 검증에서 모두 null 이었습니다. 이번에 jiti 로 더 돌린 경우도 막혔습니다. 백슬래시 점 경로('/dashboard/..\\\\/evil.com', '/dashboard\\\\..\\\\..\\\\/evil.com'), '/\\\\\\\\evil.com', '/dashboard/%2e%2e/%2fevil.com', 전각 슬래시 '/\\uFF0F/evil.com', BOM 을 앞에 붙인 '//evil.com', '/dashboard\\u00A0/..//evil.com' 은 전부 null 입니다","reversible_at":"findings 에 ERR-05 를 다시 넣으면 된다"},{"what":"'/dashboard?x=//evil.com'→'/dashboard?x=//evil.com', '/dashboard#//evil.com'→'/dashboard' 허용은 안전하다고 판정했다","why":"반환값의 pathname 은 언제나 '/dashboard' 로 시작하고, 이것이 path-absolute 경로입니다. 그래서 브라우저가 다시 해석해도(new URL(r, origin)) origin 이 바뀌지 않습니다. 허용된 20개 경우 모두 origin 이 https://app.example 로 같았고, normalizeReturnPath(r)===r 였습니다. 다시 해석될 여지는 네 갈래로 따져 봤습니다. (1) 퍼센트 인코딩: '%252e%252e', '..%2F%2F', '..%5C%5C' 는 세그먼트 안에 인코딩된 채 남습니다. Next 클라이언트 라우터는 canonicalUrl 을 new URL 의 pathname+search+hash 로 만들어 한 번 더 디코드하지 않습니다. (2) 유니코드: 전각 점, U+2025, 제로폭 공백, U+2028, U+0085 는 %XX 로 인코딩되고 점 세그먼트로 취급되지 않습니다. (3) 공백: 선행 공백은 38행 startsWith('/') 에서 거부됩니다. 후행 공백은 URL 파서가 지워서 '/dashboard' 가 됩니다. (4) '//' 가 경로 중간에 남는 경우('/dashboard//evil.com', '/dashboard/..;/..//evil.com', '/dashboard/%0a/..//evil.com' → 모두 '/dashboard//evil.com'): next start 서버 base-server.js:578-580 이 normalizeRepeatedSlashes(utils.js:130-136) 로 308 을 보내 '/dashboard/evil.com' 이 되므로 같은 출처에 머뭅니다. 쿼리 값은 dashboard 쪽에서 아무도 읽지 않습니다. src 에서 useSearchParams 를 쓰는 곳은 InputView.tsx 한 곳뿐입니다","reversible_at":"findings 에 ERR-05b 로 추가하면 된다"},{"what":"ERR-06 닫힘","why":"growth/api/index.ts:124 가 readStore()===null 이면 false 를 돌려줍니다. jiti 와 가짜 localStorage 로 확인했습니다. 저장소가 '{broken' 이면 saveGrowthRecord → false 이고 raw 가 바뀌지 않습니다. 형식이 틀린 기록 1개가 섞여 있으면 → true, ids a,o1,n1 입니다. 기록을 걸러 내 지우는 동작은 39-45행 주석에 의도로 적혀 있습니다. 여기서 생긴 부작용은 ERR-08 로 따로 냈습니다","reversible_at":"findings 에 ERR-06 을 다시 넣으면 된다"},{"what":"vaccination 저장소를 every 에서 필터로 바꾼 것 자체에는 지적하지 않는다","why":"jiti 결과: 항목 1개가 틀린 저장소에서 setDoseCompleted → true 이고, 틀린 항목만 빠지고 c1/a, c2/b 는 보존됩니다. 저장소가 없을 때 첫 저장 → true 입니다. 손상 시 쓰기를 거부하는 것은 growth 와 규칙이 같습니다. 문제는 호출부가 그 결과를 받지 않는다는 점이고, ERR-07 로 냈습니다","reversible_at":"findings 에 ERR-07 로 합치면 된다"},{"what":"DSG-02 닫힘","why":"formula.md 34행 state:error 가 이제 'result 는 그리지 않는다. preemie-note 는 20행 규칙대로 … 그대로 남는다' 입니다. 20행('계산 성공 여부와 무관하게 … 항상')과 더는 모순되지 않고, 구현(FormulaPanelSection.tsx:35, ages.correctionApplies 만 봄)과 같습니다. designer 핸드오프 status 는 done 입니다","reversible_at":"findings 에 DSG-02 를 다시 넣으면 된다"},{"what":"ERR-07 을 major 가 아닌 minor 로 두었다(tie-break)","why":"심각도 표로는 '에러 처리가 없어 사용자가 무응답을 본다' 에 해당해 major 입니다. 하지만 손상된 저장소는 앱이 스스로 만드는 값이 아닙니다. 외부에서 고친 경우나 나중에 version 을 올린 경우에만 생깁니다. 지난 라운드 ERR-06 도 같은 이유로 minor 였습니다. 두 등급이 갈려 낮은 쪽을 골랐습니다","reversible_at":"손상 저장소를 앱이 만드는 경로가 확인되면 ERR-07 의 severity 를 major 로 올리면 된다"},{"what":"TEAM-01, PC-F5 경계, 남은 P3 는 다시 내지 않았다. lint·typecheck 가 잡는 항목도 뺐다(두 명령 모두 0건)","why":"지시서 CONTEXT 가 다시 내지 말라고 했습니다","reversible_at":"지시서 CONTEXT"},{"what":"가드 훅이 node -e 명령 일부를 막았다('too complex to verify that it stays inside the worktree'). 우회하지 않고 테스트 값을 여러 명령으로 나눠 다시 돌렸다","why":"가드 메시지가 명령을 나누라고 안내했습니다. 유니코드 테스트 값은 \\u 이스케이프 대신 String.fromCharCode 로 만들었습니다. typecheck 출력은 종료 코드와 오류 수를 보려고 세션 scratchpad(tc.log)에 한 번 저장했습니다. 워크트리에는 아무것도 쓰지 않았습니다","reversible_at":"없음(기록용)"}],"blocked_on":[],"verification":[{"command":"pnpm typecheck (profile.commands.typecheck)","result":"EXIT=0, 'error TS' 0건. apps/preemie-calc 도 'Types generated successfully' 뒤에 Done","passed":true},{"command":"pnpm lint (profile.commands.lint)","result":"eslint . 와 7개 워크스페이스 lint 모두 Done. error·warning 출력 0건","passed":true},{"command":"jiti: normalizeReturnPath 31개 경우(쿼리·해시 4 + 백슬래시·유니코드·인코딩·공백·제어 문자 27)","result":"null 11건: 백슬래시 점 경로 2, '/\\\\\\\\evil.com', '%2e%2e/%2f', 전각 슬래시, 선행 BOM, 슬래시 앞 NBSP. 허용 20건은 전부 '/dashboard' 로 시작하고, 다시 해석한 origin 이 https://app.example 로 같고, idem=true. '/dashboard?x=//evil.com'→그대로, '/dashboard#//evil.com'→'/dashboard', '/dashboard ' →'/dashboard', '/dashboard/..;/..//evil.com'→'/dashboard//evil.com'","passed":true},{"command":"jiti + 가짜 window.localStorage: setDoseCompleted, loadCompletedDoseIds, saveGrowthRecord, loadGrowthRecords","result":"vaccination: '{broken' → set=false, load=corrupted, raw 그대로. version 2 → set=false, load=corrupted. 틀린 항목 1개 → set=true, 틀린 항목만 빠짐. 저장소 없음 → true. growth: '{broken' → save=false, load=corrupted, raw 그대로. 틀린 기록 1개 → true, ids a,o1,n1","passed":true},{"command":"소스 대조: node_modules/next/dist/server/base-server.js:572-581, shared/lib/utils.js:130-136","result":"경로에 '\\\\' 나 '//' 가 있으면 반복 슬래시를 하나로 줄여 308 을 보낸다. '/dashboard' 로 시작하는 값은 줄인 뒤에도 '/d' 로 시작해 같은 출처에 머문다","passed":true}],"findings":[{"id":"ERR-07","kind":"failure-path","severity":"minor","what":"vaccination 저장소가 손상됐으면 setDoseCompleted 가 이제 false 를 돌려주는데, 호출부는 반환값을 버려서 접종 완료 체크가 아무 안내 없이 되돌아간다","where":"apps/preemie-calc/src/widgets/vaccination-plan/ui/VaccinationPlanSection.tsx:51","why":"이번 수정(vaccination/api/index.ts:103)으로 손상 저장소에서 쓰기를 거부하게 됐습니다. 예전에는 덮어써서 체크가 됐습니다. 지금은 체크박스가 제어 컴포넌트(completed={d.status==='done'})라 눌러도 바로 원래대로 돌아가고, 오류 문구가 없습니다. '정보 전체 삭제' 전까지는 계속 이 상태입니다. growth 쪽은 같은 경우에 GrowthEntryForm 이 saveError 문구를 보여 줍니다. 앱이 스스로 손상 저장소를 만드는 경로가 없어 tie-break 로 minor 를 골랐습니다(decisions 참고). 수정 방향: handleToggle 에서 false 를 받으면 role=alert 문구를 보여 주거나, loadCompletedDoseIds 가 corrupted 일 때 복구 안내를 보여 준다","evidence":"재현: localStorage 'preemie-calc/vaccinations' 를 '{broken' 이나 {version:2,...} 로 두고 예방접종 화면에서 회차를 체크한다. 실행: jiti 와 가짜 localStorage 로 setDoseCompleted('c1','bcg',true) → false, loadCompletedDoseIds('c1') → {status:'corrupted'} → 화면은 completedDoseIds=[] 로 그림(VaccinationPlanSection.tsx:45). 화면에서 체크가 되돌아가는 것은 브라우저로 확인하지 못함(읽기만 함)"},{"id":"ERR-08","kind":"failure-path","severity":"minor","what":"growth 저장소가 손상되면 성장 기록 저장이 '정보 전체 삭제' 전까지 계속 실패한다. 그런데 패널 주석은 '새 기록 저장으로 스스로 회복된다' 고 적혀 있고, 사용자에게는 원인과 다른 '저장 공간을 확인해 주세요' 가 보인다","where":"apps/preemie-calc/src/entities/growth/api/index.ts:124","why":"ERR-06 수정의 결과로 GrowthPanelSection.tsx:30-32 의 전제('기록 저장소는 손상돼도 새 기록 저장으로 스스로 회복된다 … corrupted 도 아직 없음과 같은 화면')가 틀리게 됐습니다. 지금 흐름은 이렇습니다. 빈 목록을 보여 줍니다 → 입력을 받습니다 → 매번 저장에 실패합니다 → GrowthEntryForm 이 용량 문제처럼 보이는 문구를 냅니다. 데이터를 지키는 것은 맞는 방향이라 결함의 크기는 작고, 트리거도 외부 손상뿐이라 minor 입니다. 수정 방향: 패널 주석을 실제 동작에 맞추고, loadGrowthRecords 가 corrupted 일 때나 저장이 실패할 때 '저장된 기록을 읽지 못했습니다 … 정보 전체 삭제로 초기화' 처럼 원인에 맞는 안내를 보여 준다","evidence":"재현: localStorage 'preemie-calc/growth-records' 를 '{broken' 으로 두고 성장 기록을 저장한다. 실행: jiti 와 가짜 localStorage 로 saveGrowthRecord → false, loadGrowthRecords('c1') → {status:'corrupted'}, raw '{broken' 그대로. 주석 위치: GrowthPanelSection.tsx:30-32. 문구 위치: GrowthEntryForm.tsx 의 saveError 분기('저장하지 못했습니다. 저장 공간을 확인해 주세요'). 화면 표시는 브라우저로 확인하지 못함(읽기만 함)"}]}
